"number","capability","company","description","initiative_title","primary_category"
"A2E00109","Security Orchestration, Automation, and Response (SOAR)","Globex Financial Services","The customer needs an in-depth review of middleware options and requirements for integrating their current security solutions with ServiceNow Security Operations. They are focused on ensuring that integrations support rapid threat detection and response, while addressing data privacy concerns.","Security Platform Middleware Requirements Review","Technical and business Strategy"
"A2E00110","Subscription Lifecycle Management","Acme Financial Services","The customer aims to initiate an early renewal of their App Engine subscription to prevent any disruption in business-critical services. They seek guidance on best practices for renewal, contract management, and understanding the full lifecycle of their App Engine deployment to ensure seamless continuity.","Proactive App Engine Renewal Strategy","Technical and business Strategy"
"A2E00111","Employee Onboarding Automation","Luminex Technologies","The HR manager is seeking a comprehensive overview of the onboarding process for new users within ServiceNow. The goal is to ensure all steps are clearly defined, automated where possible, and that users have access to the necessary resources from day one. The manager aims to enhance efficiency, reduce manual intervention, and provide a consistent onboarding experience.","Streamlined Onboarding for New Employees","Product Overview"
"A2E00112","Workflow Designer and Automation","BrightPath Solutions","The customer aims to optimize business operations by designing and deploying a custom workflow using App Engine. Their goal is to streamline process automation, enhance cross-department collaboration, and ensure scalability to meet future needs. They seek guidance on best practices for configuring workflow components, integrating with existing data sources, and measuring workflow performance.","Accelerate Custom Workflow Deployment","Technical How-To"
"A2E00113","Field Service Management Multi-Region Scheduling","GlobeTech Services Inc.","The customer is seeking guidance on best practices to scale Field Service Management (FSM) across multiple geographic regions. Their goal is to ensure seamless coordination of service teams, standardized processes, and efficient resource allocation while maintaining compliance with regional regulations. They are interested in learning how to leverage Servicenow's FSM capabilities to support multi-region scheduling, dispatch, and reporting.","Scaling FSM for Global Service Operations","Solution Review"
"A2E00114","Regulatory Compliance Reporting","BlueWave Financial Group","The customer is seeking to implement an automated reporting framework within ServiceNow to ensure adherence to evolving regulatory standards. Their goal is to streamline the collection, aggregation, and presentation of compliance data to reduce manual effort and error, while supporting timely audits and internal reviews.","Automated Compliance Reporting Enhancement","Solution Review"
"A2E00115","Performance Analytics","TechWave Solutions","The customer aims to implement robust monitoring for application performance and usage metrics, seeking actionable insights to improve system responsiveness and user experience. Their approach focuses on leveraging analytics dashboards to detect bottlenecks and proactively address latency issues as their user base grows.","Optimize Real-Time Performance Monitoring","Technical How-To"
"A2E00116","Notification Configuration","TechNova Solutions","Customer aims to proactively inform stakeholders about change status updates by customizing notification templates and delivery channels, ensuring timely and relevant communication throughout the change lifecycle.","Enable Custom Change Status Notifications","Technical How-To"
"A2E00117","Change Management Integration with DevOps","Bluefin Technologies","The customer is experiencing delays and compliance issues due to manual change approvals within their continuous integration and delivery pipelines. They aim to automate change management integration, ensuring faster releases while maintaining governance and audit trails.","Streamline Change Approval in CI/CD","Technical How-To"
"A2E00118","Entitlement Management","Acme Utilities Ltd.","The customer is experiencing issues with duplicate Field Service Management (FSM) entitlements within their Servicenow environment. Their goal is to understand how these duplicates occur, devise a solution to prevent future duplications, and optimize entitlement management for streamlined user access. The customer seeks a clear approach to auditing, monitoring, and maintaining entitlements to support their business processes.","Eliminating Duplicate FSM Entitlements","Solution Review"
"A2E00119","Major Incident Management","BrightWave Technologies","The customer is concerned that users are not receiving timely updates or clear communications during major incident events. Their goal is to leverage Servicenow's capabilities to streamline notifications, automate status updates, and ensure that key stakeholders have visibility into incident progress. The approach involves assessing current workflows, integrating automated communication channels, and training users on new dashboard functionalities for transparency.","Improving User Experience During Major Incident Management","Solution Review"
"A2E00120","CRM Integration Evaluation","Brightwave Solutions","The customer aims to evaluate the readiness of their CRM system for a full-scale ITSM deployment. Their goal is to identify technical and business dependencies, learn about integration patterns, and determine the most effective strategy for data synchronization and workflow automation.","Assessing CRM Compatibility for ITSM Rollout","Technical and business Strategy"
"A2E00121","UI Customization","Acme Financial Group","Our team has received feedback that the icons within the Security module are not easily understood by new and existing users. We want to work collaboratively to redesign the iconography so that it better communicates functionality and improves overall user experience. Our goal is to reduce confusion and help all users quickly navigate the module with confidence.","Simplify Security Module Icons","Product Feedback"
"A2E00122","Risk Management Workspace","Oakridge Financial Services","The customer aims to establish a systematic approach for reviewing and updating risk registers across their ServiceNow implementation. Their goal is to ensure risks are identified, assessed, and mitigated in alignment with changing business priorities by leveraging automation and reporting capabilities within ServiceNow. The focus is on increasing visibility, accountability, and timely response to emerging risks.","Proactive Risk Register Management Enhancement","Solution Review"
"A2E00123","Asset Lifecycle Automation","Blue Ridge Technologies","The customer seeks to streamline and simplify the IT Asset Management (ITAM) asset tracking process, aiming for a more intuitive experience for end users. Their goal is to identify areas within their current workflow where friction exists and implement best practices using Servicenow to enhance usability, increase adoption rates, and reduce manual effort.","Optimizing User Experience in ITAM Asset Tracking","Solution Review"
"A2E00124","ITOM Visibility and Automation","Acme Technologies Inc.","The customer is seeking to move from a basic to a premium IT Operations Management (ITOM) entitlement in order to leverage advanced automation, enhanced service visibility, and proactive operations. Their goal is to optimize IT resource usage, reduce incidents, and improve business continuity by utilizing the full spectrum of premium ITOM features. They aim to understand the benefits, implementation approach, and best practices for the upgrade.","Upgrade to Premium ITOM Entitlement","Product Overview"
"A2E00125","Role-Based Audit Logging & Reporting","BrightPath Healthcare","The customer is interested in learning best practices for configuring audit trail features to ensure that users with specific roles—such as risk managers, auditors, and system administrators—are given appropriate levels of access to audit logs while maintaining strict data governance protocols.","Optimizing Role-Based Audit Trail Reporting","Technical How-To"
"A2E00126","FSM Mobile Reporting & Analytics","BrightGrid Solutions","The customer wishes to provide targeted feedback on the current FSM mobile application, focusing on usability, navigation, and reporting features. Their aim is to collaborate with the product team to suggest enhancements that align with field user requirements and drive higher operational effectiveness. They are interested in understanding upcoming roadmap items and how their feedback can influence future releases.","FSM Mobile App Enhancement Feedback","Product Feedback"
"A2E00127","FSM Scalability and Load Handling","TriPoint Maintenance Corp.","The customer wishes to understand how ServiceNow FSM can be configured or improved to avoid tool freezes when managing a high volume of field service tasks. They are seeking best practices, technical guidance, and potential product enhancements to achieve consistent scheduling performance.","Increase Scheduling Reliability in FSM Under Load","Technical How-To"
"A2E00128","Case Assignment Automation","Global Retail Group","This intake is focused on configuring and refining automated rules for task allocation within the ServiceNow platform, specifically targeting improvements in customer service case assignments. The goal is to streamline case handling and ensure that the most qualified agents receive relevant cases promptly.","Enhancing Automated Task Assignment","Solution Review"
"A2E00129","Security Operations","Ascendia Technologies","The organization seeks to define and implement standardized security requirements for all newly initiated projects within the ServiceNow ecosystem. The primary goal is to ensure that each project adheres to best practices in data protection, access management, and compliance, thereby reducing risks and improving overall governance. The customer aims to understand and leverage ServiceNow’s native security capabilities to facilitate this objective.","Establish Comprehensive Security Controls for New Projects","Solution Review"
"A2E00130","Joint Vulnerability Identification and Remediation","Acme Financial Group","The customer is seeking to integrate vulnerability management features between their Security Operations and IT Asset Management products. Their goal is to have seamless visibility and automated workflows to identify, prioritize, and remediate vulnerabilities across IT assets. They want to learn best practices and understand how to leverage ServiceNow capabilities for improved collaboration between security and ITAM teams, ultimately reducing their risk exposure.","Unified Vulnerability Management Enhancement","Solution Review"
"A2E00131","Knowledge Management","Orion Financial Group","The customer aims to fully utilize ServiceNow's Knowledge Management capabilities after their migration. They wish to streamline knowledge article creation, review cycles, and user adoption, with a focus on measuring and improving self-service resolution rates. Guidance on effective taxonomy, article lifecycle governance, and analytics is requested.","Optimizing Knowledge Management Post Go-Live","Solution Review"
"A2E00132","Usage Analytics","Acme Solutions","Customer aims to gain a comprehensive understanding of current license consumption trends and develop strategies to proactively monitor and manage future allocations, stemming from an audit uncovering over-provisioned licenses.","Understanding License Consumption Patterns in Platform Foundations","Technical How-To"
"A2E00133","Strategic Portfolio Management (SPM): Module Deployment & Integration","Innovatech Solutions Inc.","The portfolio manager aims to understand best practices and rollout strategies for the ServiceNow Strategic Portfolio Management (SPM) module. Objectives include enabling faster onboarding, aligning SPM capabilities with existing project management workflows, and facilitating cross-functional visibility. The request seeks detailed insights on module configuration, integration challenges, and measurement of success metrics for adoption.","Accelerating SPM Module Adoption Across Business Units","Product Overview"
"A2E00134","Integration Hub","Acme Corp","Customer aims to establish real-time data synchronization between ITSM and HR modules for consistent employee record management. Focus on integrating identity management and access provisioning.","Enable Seamless Data Flow Across IT and HR Systems","Technical How-To"
"A2E00135","Virtual Agent Automation","InfiniTech Solutions","The customer seeks to streamline and elevate user experience within their digital environment by implementing automation across key interaction points. Their goal is to reduce manual intervention and improve overall efficiency through the adoption of advanced ServiceNow automation capabilities.","Automated User Engagement Enhancement","Technical How-To"
"A2E00136","Platform Efficiency Enhancements","Acme Technologies","The customer seeks to streamline their operational efficiencies by leveraging the latest Platform Foundations update bundled with App Engine enhancements. Their goal is to gain a comprehensive understanding of how these new efficiency features can be integrated into existing processes for improved automation and scalability.","Optimizing Platform Foundations with App Engine","Product Overview"
"A2E00137","IT Operations Management (ITOM) Discovery","Horizon Financial Group","The customer is seeking guidance on enabling ITOM monitoring to effectively ingest and process data from legacy systems that are currently unsupported. They want to understand integration options, best practices, and potential product enhancements to bridge the visibility gap in their IT infrastructure operations.","Modernize ITOM Data Collection","Product Feedback"
"A2E00138","Predictive Intelligence","NovaTech Solutions","The customer wants to leverage artificial intelligence and robotic process automation to optimize incident response times and minimize manual effort in their IT service management processes. They are seeking guidance on best practices for integrating these technologies into their existing ServiceNow workflows, and aligning them with industry standards.","Accelerating Incident Resolution with AI and RPA","Technical and business Strategy"
"A2E00139","Risk Management Automation","Vertex Analytics Group","The customer seeks to optimize and reduce the lag associated with risk assessment calculations within their Servicenow environment. Their goal is to enhance the accuracy and speed of risk reporting by leveraging automated processes and advanced analytics, thereby supporting proactive decision-making.","Accelerating Risk Assessment Timelines","Solution Review"
"A2E00140","IT Asset Management Search Optimization","TechNova Solutions","The customer is experiencing slow response times when searching for assets within the ITAM module. Their primary goal is to optimize asset search functionality to support rapid decision-making and efficient asset management. They are interested in understanding the underlying causes of sluggish search performance and exploring best practices for configuration, indexing, and data model optimization in ServiceNow.","Enhancing ITAM Asset Search Performance","Technical How-To"
"A2E00141","Knowledge Management","BrightWave Enterprises","The customer is concerned with the relevance and clarity of knowledge articles within the ITSM self-service portal. Their goal is to enable employees to better contribute and access helpful documentation, thereby empowering collaborative learning and reducing repeat inquiries.","Collaborative Knowledge Base Improvement","Solution Review"
"A2E00142","Strategic Portfolio Management","InnovaTech Solutions","The customer aims to improve their release planning by integrating technical debt reduction activities alongside new feature delivery. Their goal is to understand how to balance innovation with long-term platform stability, leveraging Servicenow best practices for strategic portfolio management.","Align Feature Delivery and Technical Debt Reduction","Technical and business Strategy"
"A2E00143","Security Incident Response Automation","Guardian Financial Group","The customer is seeking to strengthen their incident response processes by automating containment actions when security breaches are detected. Their goal is to minimize the potential impact of breaches by enabling rapid, consistent, and reliable containment workflows within the ServiceNow platform. They want to learn how to set up effective automation, integrate with existing security tools, and ensure that containment steps align with industry best practices.","Automating Security Breach Containment","Technical How-To"
"A2E00144","Field Service Management Licensing and Feature Optimization","Acme Manufacturing Inc.","Customer is seeking to downgrade their Field Service Management entitlement to reduce operational costs while maintaining essential service capabilities. They want guidance on minimizing impact to workflows and learning which FSM features are core versus premium.","FSM Entitlement Downgrade for Cost Optimization","Entitlement"
"A2E00145","Automated Accessible Forms","DiversityWorks Inc.","The customer is focused on automating HR onboarding forms while ensuring that all accessibility guidelines are met. Their approach involves understanding available ServiceNow capabilities for accessible form creation, gathering feedback from users with accessibility needs, and collaborating with IT to implement improvements.","Inclusive HR Form Automation","Product Feedback"
"A2E00146","Security Operations - Vulnerability Response","Insight Dynamics Ltd.","The security team seeks to establish a comprehensive process for conducting pre-deployment security checks on ServiceNow applications. Their goal is to identify potential vulnerabilities, ensure compliance with internal security standards, and reduce risk prior to moving new functionality into production.","Pre-Deployment Security Validation for ServiceNow Applications","Solution Review"
"A2E00147","Role-Based Access Control","GlobalEdge Corp","The customer intends to gain a deep understanding of how permissions are structured within the Workplace mobile app, with a focus on technical documentation and product capabilities. The objective is to enable IT administrators to configure permissions effectively and to support future scalability as business needs evolve.","Evaluation of Permission Structures in Mobile Workplace","Technical How-To"
"A2E00148","Mobile Agent App","Greenfield Utilities Group","Our leadership team seeks to enhance the mobile experiences available to field agents, enabling them to resolve service tickets and access relevant resources efficiently while on the go. The goal is to improve response times, promote user adoption, and reduce friction, especially for those who rely on mobile devices during client visits. We are interested in understanding best practices as well as new and upcoming mobile features within the Servicenow platform.","Empower Field Agents with Mobile-First Service","Product Roadmap"
"A2E00149","Cloud Cost Management","Brightwave Technologies","The customer is seeking to evaluate current App Engine hosting expenses and identify opportunities for cost optimization. They aim to understand consumption patterns, set usage benchmarks, and leverage cost management capabilities within Servicenow to ensure scalable yet cost-effective cloud operations.","Optimizing App Engine Cloud Hosting Costs","Solution Review"
"A2E00150","Field Service Management Scheduling Optimization","Vertex Utilities Inc.","The customer seeks to ensure the accuracy and efficiency of Field Service Management (FSM) scheduling algorithms. They are concerned about potential mismatches between scheduled assignments and technician availability, aiming to optimize resource allocation and minimize service delays. Their approach is to conduct rigorous testing and validation of the algorithm within their ServiceNow environment, focusing on data integrity and real-world scheduling constraints.","Validating FSM Scheduling Algorithms for Reliability","Solution Review"
"A2E00151","Workflow Optimization and Monitoring","InnoTech Solutions","The customer seeks to understand latency bottlenecks in their App Engine workflows and aims to proactively improve system responsiveness. Their goal is to identify root causes, apply best practices, and leverage automation to minimize delays, ensuring a scalable and efficient workflow experience across business units.","Accelerating App Engine Workflow Performance","Technical and Business Strategy"
"A2E00152","Dashboard Customization and Analytics","Vertex Solutions","The customer is seeking a comprehensive walkthrough of the latest ITSM dashboard features to better understand usability, reporting options, and customization capabilities. Their goal is to empower their teams to leverage new functionalities for improved incident and request management.","ITSM Dashboard Feature Walkthrough","Product Overview"
"A2E00153","HR Service Delivery","Acme Corporation","The customer is seeking a tailored training program to empower their HR team with advanced knowledge of ServiceNow’s HR Service Delivery capabilities. Their primary goal is to streamline employee onboarding and case management, ensuring the team can utilize automation and self-service features efficiently. They are looking to upskill both technical and non-technical staff and desire hands-on demonstrations followed by Q&A sessions.","Custom Training Program for HR Automation","Technical How-To"
"A2E00154","Automated Evidence Collection","BrightStar Telecommunications","The client wants to explore solutions for automating evidence collection and reporting via Servicenow’s security compliance module. Their goal is to reduce manual effort, increase accuracy, and better prepare for both internal and external audits.","Automating Compliance Evidence Collection","Technical How-To"
"A2E00155","Integration Framework","BrightPath Technologies","The organization aims to rapidly implement the new CRM connectors introduced by App Engine. Their objective is to gain a comprehensive understanding of the connector features, integration best practices, and security considerations to support a scalable deployment across business units.","Accelerated CRM Connector Adoption","Technical and business Strategy"
"A2E00156","Mobile Workforce Enablement","Summit Logistics Corp","In light of budget limitations, the customer wishes to gain in-depth product knowledge to prioritize feature adoption. Their goal is to determine which FSM modules align best with critical business needs and justify continued investment.","FSM Feature Prioritization under Financial Limits","Product Overview"
"A2E00157","Integration Best Practices","BrightPath Solutions","The customer requires detailed guidance on best practices for integrating Servicenow with third-party HR solutions, focusing on authentication, data synchronization, and ongoing maintenance. The intention is to support a scalable integration strategy that minimizes disruption and supports HR digital transformation initiatives.","Defining Best Practices for HR System Integration","Solution Review"
"A2E00158","Mobile User Interface Customization","Reliant Field Services","The customer has identified that mobile app buttons within the FSM product are currently too small, impacting user efficiency and increasing the risk of errors. Their goal is to improve the accessibility and usability of the mobile interface by resizing buttons to better accommodate touch interactions, ensuring a more intuitive experience for field service agents.","Enhancing Mobile Button Accessibility","Product Feedback"
"A2E00159","Access Control Configuration","GlobalEdge Solutions","The customer’s primary concern is to foster an inclusive environment where all relevant stakeholders can easily request and access catalog items. Their goal is to use Servicenow's access control capabilities to remove barriers while ensuring compliance and transparency. The approach includes feedback collection and iterative improvement of access policies.","Inclusive Catalog Item Access for All Stakeholders","Product Feedback"
"A2E00160","FSM Product Roadmap - Offline Support","Innovatech Services Inc.","The customer is reviewing strategic investments in mobile field workforce enablement, and wishes to gain insight into the planned enhancements for offline mode within FSM. They require detailed information on the product roadmap, upcoming features, and alignment with their organization's digital transformation goals.","Assess Product Roadmap for Offline FSM Advancements","Product Roadmap"
"A2E00161","Operational Intelligence","Bluewave Networks","The customer has identified that the current ITOM troubleshooting steps are outdated, leading to inefficiencies and delays in resolving operational issues. Their goal is to modernize the troubleshooting process by incorporating best practices, automation, and the latest platform capabilities to empower support teams and improve incident resolution times.","Update ITOM Troubleshooting Documentation","Technical How-To"
"A2E00162","Data Protection","BrightEdge Healthcare","The customer needs a comprehensive overview and feedback session regarding new encryption features available in ServiceNow. Their focus is to better understand the roadmap and how these enhancements align with their ongoing compliance initiatives.","Review of Data Protection Enhancements","Product Roadmap"
