"number","capability","company","description","initiative_title","primary_category"
"A2E00428","User Access and Permissions","Fusion Enterprises","Aiming to delegate specific administrative tasks, the customer wishes to understand best practices and limitations around custom role creation. Their focus is to support departmental autonomy while preserving centralized oversight and minimizing security risks.","Optimizing Custom Role Creation for Departmental Self-Service","Solution Review"
"A2E00429","Performance Analytics","Acme Financial Services","The customer has observed significant delays in the ServiceNow ITSM portal during peak business hours, impacting user productivity and satisfaction. Their primary goal is to identify performance bottlenecks and implement best practices to ensure a seamless experience, especially when usage spikes. They are interested in learning how to monitor, analyze, and proactively optimize portal speed across their organization.","Optimize ITSM Portal Performance During Peak Hours","Technical How-To"
"A2E00430","Real-Time Analytics and Routing","Metro Utilities Group","Aiming to leverage real-time analytics within FSM to dynamically allocate technicians based on workload, territory, and skillset, specifically targeting improvements during traffic-heavy periods.","Real-Time Technician Allocation Insights","Technical How-To"
"A2E00431","SaaS Integration","BrightTech Solutions","The customer wants to learn how SaaS offerings can be leveraged to improve self-service capabilities and overall user experience for employees. They are particularly interested in understanding how Servicenow's Employee Experience solutions can integrate with third-party SaaS products to streamline workflows and reduce manual effort. Their approach is focused on increasing productivity and satisfaction through seamless cloud service integration.","Enhancing Employee Experience with SaaS Applications","Solution Review"
"A2E00432","License Management and Transfer Automation","Acme Utilities Group","Following the organizational restructure, the customer seeks guidance on efficiently transferring FSM licenses to newly formed business units to ensure uninterrupted field service operations and compliance.","FSM License Reallocation Post-Restructure","Technical How-To"
"A2E00433","Automated Test Framework (ATF)","Synergy Solutions Inc.","The customer is aiming to implement automated testing frameworks to improve the reliability and speed of application releases. Their goal is to reduce manual testing efforts, enhance collaboration across development teams, and ensure consistent quality with every deployment. They are seeking guidance on best practices for setting up automated tests within ServiceNow, integrating with CI/CD pipelines, and understanding the full range of testing capabilities available.","Automated Testing for Reliable App Releases","Technical How-To"
"A2E00434","Real-Time Incident Reporting","Synergy Solutions Inc.","The customer is seeking to better understand real-time incident reporting capabilities to improve visibility and responsiveness within their ITSM environment. They are interested in learning how to leverage built-in dashboards, configure automated alerts, and enable collaborative workflows for faster incident resolution. The goal is to empower their teams to monitor incidents as they occur and take prompt, informed actions.","Real-Time Incident Reporting Enhancement","Product Overview"
"A2E00435","Security Integrations and Automation","Globex Corporation","The request is to gain clarity on the available integrations between ServiceNow and third-party security tools such as SIEM and identity providers. The customer is interested in understanding how these integrations can enhance monitoring, automate incident response, and maintain continuous compliance.","Evaluation of Security Integrations in ServiceNow","Technical How-To"
"A2E00436","Early Access to Beta Features","Innovatech Solutions","The customer is eager to explore and provide feedback on new beta features within Platform Foundations. Their goal is to be an early adopter, actively engage with the product team, and foster a collaborative approach to drive platform improvements. They aim to understand upcoming functionalities, assess fit for their business, and contribute to a thriving user community.","Beta Feature Access Collaboration","Product Feedback"
"A2E00437","FSM Mobile Offline Access","TransGlobe Utilities","The company seeks to implement a robust offline mode for field service agents using the ServiceNow Field Service Management (FSM) mobile application. The aim is to ensure uninterrupted access to essential service tasks and data in areas with limited or no network connectivity. The customer is interested in understanding best practices, technical requirements, and limitations associated with offline capabilities.","Enable Offline Functionality for Field Service Mobile Users","Technical How-To"
"A2E00438","Integration Optimization","Global Retail Corp","The customer seeks guidance on optimizing the performance of Platform Foundations integration, wishing to learn about available configuration options and recommended troubleshooting steps for intermittent sync failures.","Optimize sync performance across Platform Foundations","Solution Review"
"A2E00439","Security Incident Response Automation","Quantum Financial Services","The customer is seeking to implement robust automated mechanisms within their Servicenow environment to detect and respond to security incidents in real-time. The goal is to minimize manual intervention, improve incident response times, and ensure comprehensive oversight of potential threats across their digital assets. The approach focuses on leveraging advanced analytics and integration with existing security operations to streamline detection and escalation processes.","Automated Security Incident Detection Enhancement","Solution Review"
"A2E00440","Workflow Automation","BrightPath Technologies","Our customer service team is aiming to enhance efficiency and response times by leveraging automated workflows. We are seeking guidance on best practices for implementing automation within ServiceNow, understanding key performance indicators, and evaluating the impact on customer satisfaction. The goal is to ensure our agents can focus on high-value interactions while repetitive tasks are streamlined, ultimately driving measurable return on investment.","Maximizing ROI through Automated Customer Service Workflows","Solution Review"
"A2E00441","ITOM Visibility","BrightPath Solutions","The customer is seeking a comprehensive walkthrough of the IT Operations Management data flow, including integration points and system components within ServiceNow. Their goal is to understand how data moves between different modules and how each part contributes to overall operational efficiency.","Clarifying ITOM Data Flow","Technical How-To"
"A2E00442","UI Customization and Accessibility","Acme Corporation","Our employees have reported discomfort and reduced productivity due to the current color scheme of the workplace application, which causes significant eye strain. We aim to collaborate with Servicenow to explore customization options for color themes and enhance accessibility for all users. Our goal is to create a more inclusive environment that supports employee well-being while maintaining brand consistency.","Reduce Eye Strain from App Color Scheme","Product Feedback"
"A2E00443","Value Tracking and Reporting","Northstar Health Group","The customer wants to explore how analytics within Strategic Portfolio Management can be used to track and realize value across initiatives. The focus is on learning best practices for metrics, reporting, and dashboards that demonstrate progress toward key outcomes.","Analyzing Value Realization in Strategic Portfolio Management","Solution Review"
"A2E00444","ITSM User Interface Customization","Acme Solutions","Users at the customer's organization find it challenging to locate essential modules within the ITSM dashboard. They would like a comprehensive overview and actionable recommendations to make navigation more intuitive. The customer values inclusive feedback sessions to gather diverse perspectives from end-users.","Clarify ITSM Dashboard Structure for Users","Solution Review"
"A2E00445","Adoption Planning","BrightPath Consulting","The customer is interested in learning how a staggered release of Strategic Portfolio Management features can be leveraged to drive incremental value, reduce risk, and better align with internal training schedules. They seek an overview of feature sets included in each release and advice on measuring success.","Optimizing Adoption Through Staggered Feature Deployment","Product Roadmap"
"A2E00446","License Management Analytics","Acme Technologies","The customer aims to analyze current license usage to identify underutilized and overutilized licenses, with the goal of maximizing value, reducing unnecessary costs, and ensuring compliance across all ServiceNow products.","Optimize License Utilization for Cost Savings","Solution Review"
"A2E00447","Risk Management","OptiCore Enterprises","The customer is concerned that the current risk documentation does not adequately address newly released features in the platform. Their goal is to understand how risks associated with these features are identified, documented, and mitigated, ensuring compliance and operational stability. They seek guidance on best practices for maintaining up-to-date risk documentation as their product capabilities evolve.","Enhance Risk Documentation for New Features","Solution Review"
"A2E00448","Security Operations Integration","SecureTech Solutions","The customer is experiencing frequent inconsistencies in the data returned by the security platform's API, impacting their ability to perform reliable incident analysis and reporting. Their primary goal is to understand the root causes of these inconsistencies, gain deeper insights into API data validation mechanisms, and implement best practices for ensuring data integrity across integrations.","Mitigating API Data Inconsistencies in Security Platform","Technical How-To"
"A2E00449","Field Service Management Scheduling","GloboTech Solutions","The customer seeks to understand how to overcome the FSM scheduling tool's current inability to support multi-language input. Their goal is to ensure their global workforce can utilize the tool effectively, regardless of language, and to explore potential product enhancements or workarounds that facilitate multi-language scheduling and communication within the ServiceNow platform.","Addressing Language Input Limitations in FSM Scheduling Tool","Product Feedback"
"A2E00450","Request Management","Brightline Manufacturing","The customer is seeking guidance on configuring and streamlining the request intake process for employees. Their objective is to simplify service requests, improve tracking, and align intake steps with organizational policies.","Optimizing Request Intake Process","Solution Review"
"A2E00451","User Experience Optimization","BrightPath Enterprises","Stakeholders have identified a need for more descriptive and consistent labeling in Servicenow App Engine forms. The objective is to ensure that every form field provides sufficient context, thereby improving usability for both technical and non-technical employees.","Enhance Labeling Practices in Forms","Solution Review"
"A2E00452","Role-Based Access Control","Acme Corp","The HR director is concerned about ensuring that sensitive employee information is accessible only to authorized personnel. The goal is to evaluate current permission levels, identify gaps, and implement robust data access policies for enhanced security within Servicenow.","Enhance Employee Data Access Controls","Solution Review"
"A2E00453","Legacy System Integration & AI Enablement","Innovatech Enterprises","The customer is deliberating on whether to focus immediate resources on integrating legacy systems or to shift emphasis towards implementing AI-driven ticket routing. They wish to understand the long-term business benefits, risks, and scalability of adopting advanced AI solutions within the ServiceNow platform, balancing this against the need for continued support of existing legacy workflows.","Strategic Review of Legacy Integration vs. AI Initiatives","Solution Review"
"A2E00454","Role-Based Notification Rules","NovaEdge Enterprises","The customer is exploring advanced methods to tailor incident update notifications based on user roles and impact levels. Their objective is to ensure that critical incident updates reach the right audiences with contextually relevant information, supporting better decision-making and risk mitigation.","Personalized Notification Delivery for Critical Incidents","Solution Review"
"A2E00455","CMDB Data Integration","Acme Financial Services","The customer wants to seamlessly integrate disparate asset data sources into the ServiceNow CMDB to improve data accuracy, enable proactive incident management, and promote informed decision-making. Their goal is to understand best practices for mapping, ingestion, and ongoing synchronization, with particular focus on minimizing manual reconciliation and ensuring business users have trustworthy asset visibility.","Unified Asset Data Integration with CMDB","Technical How-To"
"A2E00456","Data Import and Integration","FinSight Partners","The customer aims to efficiently import and integrate data from various external sources into ServiceNow, ensuring data accuracy and consistency. They are seeking best practices, recommended approaches, and potential automation options to enhance data onboarding and minimize manual intervention.","Streamline External Data Import","Technical How-To"
"A2E00457","Single Sign-On (SSO)","Atlas Financial Services","The customer aims to enhance security and user experience by integrating ServiceNow with their enterprise identity provider using single sign-on (SSO). Their goal is to understand configuration best practices, optimize authentication flows, and ensure compliance with corporate policies for identity management.","Enterprise SSO Integration Enablement","Technical How-To"
"A2E00458","Strategic Portfolio Management","TechNova Solutions","The customer aims to enhance their enterprise expansion strategy by leveraging advanced portfolio management capabilities within Servicenow. Their goal is to gain comprehensive visibility into current project portfolios, align initiatives with business objectives, and optimize resource allocation for maximum impact. The customer seeks guidance on best practices, integration approaches, and performance metrics to support large-scale organizational growth.","Strategic Portfolio Expansion Review","Solution Review"
"A2E00459","API Lifecycle Management","ClearPath Solutions","The customer aims to fully migrate from deprecated APIs within the ITOM module to enhance stability, security, and future integrations. The goal is to understand the migration process, required changes, and best practices for leveraging modern Servicenow APIs. The customer seeks collaborative guidance on transition strategies and wants to ensure all stakeholders are informed and involved throughout the journey.","ITOM API Modernization Roadmap","Product Roadmap"
"A2E00460","Cross-Module Integration","BluePeak Enterprises","The customer is interested in learning how SPM module dependencies interact with other ServiceNow modules, such as ITBM and APM. Their focus is on ensuring seamless data flow and accurate reporting to support informed portfolio decisions. The approach involves reviewing current integration points and identifying opportunities for automation.","Comprehensive SPM Integration Assessment","Technical How-To"
"A2E00461","Access Log Analytics","BlueWave Technologies","Customer wants to better understand user access patterns and proactively identify anomalous activities within their Servicenow environment. Their goal is to utilize analytics dashboards and advanced filtering to support internal audits and drive security improvements.","Streamline User Access Analytics","Technical How-To"
"A2E00462","Security Incident Response Automation","Novatek Solutions","The customer is focused on understanding how their current use of Servicenow Security Operations can be improved for better detection and response to emerging threats. Their goal is to identify gaps in their usage patterns, learn best practices across incident and vulnerability management, and leverage automation for faster resolution. They seek a solution review and strategic recommendations to align their workflows with industry standards.","Optimizing Security Product Usage for Enhanced Threat Detection","Solution Review"
"A2E00463","IT Service Management Automation","Alpha Tech Solutions","The customer wishes to identify and prioritize repetitive IT service requests for automation to accelerate response times, improve user satisfaction, and reduce support costs. They are focused on learning about Servicenow's automation capabilities, integration options, and how to structure their automation roadmap for scalable growth.","Optimizing IT Service Request Fulfillment","Product Overview"
"A2E00464","Release Management","Acme Logistics","The customer is concerned about the unexpected bugs discovered in the FSM module, which have caused a two-week delay in the planned release. Their goal is to understand root causes of these bugs, establish preventive measures for future releases, and ensure timely product delivery.","Mitigating FSM Module Release Delays","Solution Review"
"A2E00465","Strategic Portfolio Management","Acme Technologies","The customer is seeking in-depth guidance on the rollout of the Strategic Portfolio Management (SPM) module, including key configuration steps, adoption strategies, and metrics tracking. Their goal is to ensure a smooth implementation that aligns with organizational objectives and maximizes user engagement.","SPM Module Rollout Best Practices","Product Overview"
"A2E00466","Change Failure Response","Siemens AG","The customer aims to better understand and utilize ServiceNow features that support recovery from failed changes. Their goal is to learn best practices for configuring rollback options, enabling timely decision-making and transparent reporting during change failures. The strategy includes reviewing current product capabilities and integrating rollback processes with incident and problem management modules.","Enhancing Change Failure Recovery Protocols","Solution Review"
"A2E00467","IntegrationHub","Acme Corporation","The HR manager is seeking a comprehensive understanding of how Servicenow's HR Service Delivery solution can be integrated with external HR systems such as payroll, benefits administration, and talent management platforms. The goal is to map out integration touchpoints, data flow, and potential challenges in order to streamline HR operations and ensure data consistency across platforms.","Clarify Integration Points with External HR Systems","Technical How-To"
"A2E00468","App Engine Downgrade Management","Streamline Technologies","The customer is seeking a comprehensive understanding of the App Engine downgrade process, including required steps, potential impacts on existing workflows, and recommendations for minimizing disruption. Their goal is to confidently manage the transition and ensure continued productivity for end users.","App Engine Downgrade Process Clarification","Technical How-To"
"A2E00469","Knowledge Management","TechEdge Solutions","The company has identified that recent product updates have not been accompanied by updated Security FAQs. This lack of documentation has resulted in customer uncertainty regarding the security posture of new features. The primary goal is to understand best practices for documenting security considerations and ensuring timely communication to end users. Additionally, the customer is keen to explore Servicenow's capabilities in automating and managing security-related knowledge articles across product teams.","Addressing Security FAQ Gaps for Recent Updates","Product Feedback"
"A2E00470","License Management","BluePeak Financial","The customer seeks to better understand the renewal pricing structure for their IT Asset Management (ITAM) licenses on ServiceNow. Their goal is to explore available pricing tiers, assess value for current and anticipated usage, and identify opportunities for cost optimization. They are interested in detailed guidance on how license renewals impact future capabilities and compliance.","ITAM License Renewal Pricing Evaluation","Solution Review"
"A2E00471","Performance Analytics","InnoCore Systems","Aiming to evaluate and expand current analytics offerings, with primary interest in learning about Servicenow's predictive analytics roadmap and best practices to stay ahead of market trends.","Enhance Analytics Competitiveness","Solution Review"
"A2E00472","Reporting and Dashboarding","Brightfield Solutions","The customer intends to gain comprehensive visibility into the lifecycle of their Security product subscriptions. By utilizing Servicenow's reporting and dashboard functionalities, they plan to proactively track expiry dates and pending renewals, facilitating data-driven decisions and enhancing security compliance.","Subscription Lifecycle Visibility for Security Products","Solution Review"
"A2E00473","Integration Monitoring","Acme Manufacturing","The customer is experiencing intermittent sync issues with Platform Foundations, impacting data consistency and operational efficiency. They aim to better understand root causes and establish best practices for stable integrations.","Improve reliability of Platform Foundations sync","Technical How-To"
"A2E00474","Risk Management Dashboard Analytics","Stratosphere Financial Group","The customer aims to leverage advanced risk analytics and real-time dashboard capabilities to proactively identify, assess, and mitigate risks across their enterprise. Their goal is to enhance transparency, streamline risk reporting, and empower executive decision-making through the premium features of the Servicenow Risk module.","Risk Dashboard Enablement for Premium Clients","Product Overview"
"A2E00475","Incident Management Investigation Workflow","Vertex Dynamics","The customer aims to streamline and improve the investigation steps for incident management within their ServiceNow environment. Their goal is to gain deeper insights into incident progression, automate repetitive investigation tasks, and ensure compliance with established response protocols across teams.","Incident Tracking Enhancement","Technical How-To"
"A2E00476","Access Monitoring and Reporting","Greenfield Technologies","The customer seeks to implement automated systems to detect and report unauthorized access events across Servicenow modules, aiming to minimize security risks and ensure regulatory compliance.","Proactive Access Violation Monitoring","Solution Review"
"A2E00477","Financial Data Mapping","BluePeak Enterprises","The customer seeks guidance on mapping ITAM data structures to Finance systems for seamless cost allocations, depreciation tracking, and budget forecasting. They are interested in understanding best practices to leverage ServiceNow for cross-departmental data integrity and automated financial reporting.","Optimizing Financial Reporting from ITAM","Technical How-To"
"A2E00478","Integration Patterns & API Management","NextEra Technologies","The customer is focused on building a scalable architecture for connecting ServiceNow catalog items with external systems, ensuring adaptability to evolving business needs and third-party integrations. Emphasis is on leveraging best practices and robust integration patterns for long-term success.","Future-Proofing External Fulfillment Connections","Solution Review"
"A2E00479","Usage Reporting and Dashboarding","Sapphire Solutions Inc.","The customer is interested in learning how to leverage ServiceNow capabilities to monitor HR module license consumption across departments. Their goal is to ensure licenses are fully utilized and to prepare for future scaling as their workforce grows.","Enhance Visibility into HR License Consumption","Product Overview"
"A2E00480","UI Configuration Management","Horizon Global Technologies","The customer is reviewing the customization features in the Platform Foundations UI with the aim of supporting future business expansion. They are interested in understanding how out-of-the-box customization tools can be used to address unique business needs while maintaining upgrade compatibility.","Evaluating Customization for Strategic Growth","Solution Review"
"A2E00481","Incident Management","Vertex Solutions Inc.","The customer seeks to ensure seamless handling of incidents following a recent migration to ServiceNow ITSM. The organization's primary goal is to optimize incident workflows, minimize response times, and leverage new platform features for improved operational efficiency. They are interested in best practices for post-migration monitoring, reporting, and continuous process improvement.","Post-Migration Incident Management Support","Technical How-To"
"A2E00482","Webhook Support and Event Management","Acme Innovations Ltd.","The developer aims to understand how webhooks can be leveraged within ServiceNow App Engine to enable real-time communication with external systems. Their goal is to assess webhook configuration, security best practices, and event-driven automation possibilities to expand application interoperability.","Exploring Webhook Integration in App Engine","Technical How-To"
