"number","capability","company","description","initiative_title","primary_category"
"A2E00268","In-app Communication Channels","BrightWave Solutions","The customer aims to improve user interaction and engagement within their platform, focusing on high-impact updates while postponing social media features. Their goal is to prioritize core capabilities that deliver measurable business value before expanding to external integrations. They seek a collaborative evaluation of product areas relevant to communication, feedback, and user experience, leveraging Servicenow capabilities that align with their phased approach.","Enhancing Customer Engagement without Social Media Integration","Product Roadmap"
"A2E00269","Integration and Process Optimization","BrightStone Solutions","The HR department wants to leverage ServiceNow to create automated onboarding workflows that integrate with payroll and IT provisioning. Their goal is to understand how to configure these workflows and monitor progress, ensuring that all onboarding steps are completed efficiently across departments.","Optimizing HR Onboarding Workflows","Solution Review"
"A2E00270","Process Automation & Reporting","Grand Oak Technologies","The customer aims to streamline and automate their HR onboarding process to improve new hire experience and reduce manual effort. Their goal is to leverage advanced analytics and automated workflows to track onboarding throughput, identify bottlenecks, and ensure compliance across global offices.","Accelerating HR Onboarding Efficiency","Solution Review"
"A2E00271","Event Management","Acme Financial Services","We want to explore strategies to improve the speed and accuracy of event correlation in ServiceNow ITOM. Our goal is to minimize alert fatigue for our IT teams and ensure rapid identification of high-priority incidents impacting business services.","Optimizing ITOM Event Processing Performance","Technical How-To"
"A2E00272","Vulnerability Response","Infosec Solutions Group","The customer seeks to gain a deeper understanding of how to integrate vulnerability management within existing ITOM workflows, with the goal of reducing risk exposure and improving the efficiency of remediation activities. They are interested in best practices for automating detection, prioritization, and resolution of vulnerabilities using ServiceNow capabilities, as well as strategies for aligning IT and security teams.","Optimizing Vulnerability Remediation in ITOM","Technical How-To"
"A2E00273","Application Portfolio Management","Acme Financial Group","The customer is concerned about redundant and outdated applications within their existing portfolio, leading to increased costs and operational inefficiencies. They aim to audit all current applications, identify overlaps, and develop a strategy for consolidation and modernization leveraging Servicenow capabilities.","Application Portfolio Rationalization","Solution Review"
"A2E00274","Form Accessibility Enhancements","Empathy Solutions Ltd.","The customer aims to enhance the accessibility of HR onboarding forms to support employees with diverse needs. Their goal is to streamline the onboarding process, ensuring forms are easy to navigate and compatible with assistive technologies. They seek to learn best practices for accessible design and how to implement these within their ServiceNow environment.","Accessible Onboarding Experience","Technical How-To"
"A2E00275","User Experience Optimization","GlobalTech Solutions","The customer aims to improve the self-service portal’s accessibility and ease of use, ensuring users of varying technical backgrounds can efficiently find help and submit requests. Their approach is focused on gathering cross-departmental feedback to identify pain points and opportunities for streamlining the portal experience.","Enhancing Portal Navigation for Diverse Users","Product Feedback"
"A2E00276","Data Privacy and Compliance Management","EuroSecure Solutions Ltd.","The customer seeks to ensure full compliance with GDPR regulations in the handling, processing, and storage of customer service data within the ServiceNow platform. The goal is to understand and implement best practices to safeguard personal data, ensure lawful processing, and enable data subject rights such as access, rectification, and erasure.","GDPR Compliance Assessment for Customer Service Data","Solution Review"
"A2E00277","Dynamic Form Configuration","Apex Digital Solutions","The client aims to simplify and modernize the process for submitting IT service incidents, focusing on user-friendly dynamic forms that adapt based on initial selections. Their goal is to reduce submission errors, improve user satisfaction, and enable faster triage by leveraging Servicenow's form builder capabilities.","Streamline Incident Reporting Forms","Technical How-To"
"A2E00278","Incident Escalation Configuration","GlobalCorp Solutions","Seeking insights into configuring escalation privileges to ensure rapid and controlled incident handling, while maintaining compliance and audit tracking.","Streamline Escalation Pathways","Solution Review"
"A2E00279","Incident Management Automation","TechNova Solutions","The customer aims to improve operational efficiency by automating repetitive incident resolution tasks. Their goal is to decrease response times and ensure consistent handling of common issues within the ITSM platform.","Automating Incident Resolution","Technical How-To"
"A2E00280","Reporting & Analytics Visualization","Greenway Logistics","The customer seeks guidance on optimizing their ServiceNow FSM dashboards to ensure that critical metrics and alerts are clearly visible to field technicians. They want to learn how to implement effective layouts and visual cues for their specific business processes.","FSM Dashboard Clarity Enhancement Strategy","Technical How-To"
"A2E00281","Data Privacy Management","Acme Financial Group","Due to recent regulatory changes around data privacy, our organization seeks to better understand how ServiceNow's Risk and Security products address compliance requirements. We aim to explore available features, best practices for configuration, and integration options that support evolving privacy laws. Our goal is to ensure our workflows remain compliant and secure while leveraging ServiceNow's capabilities.","Enhancing Data Privacy Compliance in Risk and Security Modules","Product Overview"
"A2E00282","Security Operations","Horizon Financial Group","The customer seeks to ensure their ServiceNow implementation aligns with industry-recognized standards such as NIST and ISO. Their objective is to identify gaps in the current architecture, understand best practices for compliance, and establish a roadmap for ongoing adherence to regulatory and security guidelines. The approach involves a comprehensive analysis of existing workflows, data management, and security controls within relevant ServiceNow products.","Architectural Alignment with NIST and ISO Standards","Solution Review"
"A2E00283","Localization Management","GlobalTech Solutions","The customer has identified that Spanish translations within the HR portal are inaccurate, leading to confusion among Spanish-speaking employees. Their goal is to improve translation quality, ensure consistency across HR-related interfaces, and facilitate accurate communication for all users. They aim to leverage Servicenow's localization capabilities to audit and update the current content, and seek best practices to maintain translation integrity ongoing.","Spanish HR Portal Translation Accuracy Enhancement","Product Feedback"
"A2E00284","Database Optimization and Resource Management","Acme Financial Services","The customer aims to enhance the performance and scalability of their ServiceNow databases to ensure optimal resource utilization and faster query execution. Their goal is to address current bottlenecks, reduce latency, and ensure the database infrastructure supports increased workloads for future expansion.","Database Performance Optimization Initiative","Technical How-To"
"A2E00285","Form Designer & Automation","Blue Horizon Enterprises","The organization seeks to create dynamic intake forms for HR service requests to ensure employees provide relevant information upfront. Their approach involves customizing forms for different HR request types, aiming to reduce back-and-forth communication and improve request fulfillment metrics within Servicenow.","Enhance HR Service Request Intake","Solution Review"
"A2E00286","ITSM Dashboard Navigation","Acme Solutions","The customer has expressed frustration with confusing navigation within the ITSM dashboard. They are seeking guidance to better understand the dashboard layout, find key features, and streamline their daily tasks. Collaborative workshops and targeted training materials are requested to enhance user adoption and confidence.","Improve ITSM Dashboard Navigation Experience","Technical How-To"
"A2E00287","Release Management Automation","TechNova Solutions","The customer is focused on optimizing their quarterly release schedules for ITOM automation tools. Their goal is to gain a clear understanding of release management best practices within ServiceNow, and to learn how these can be applied to automate change coordination and reduce manual intervention in deployments.","Streamlining Quarterly ITOM Release Planning","Technical How-To"
"A2E00288","IoT Device Integration for Facility Service Management","Linkwell Solutions","The company seeks to leverage IoT device integration within the FSM product to automate workplace management tasks, including space utilization, real-time asset tracking, and predictive maintenance. Their goal is to reduce manual intervention, optimize resource allocation, and improve employee productivity by enabling automated data flows from connected devices into their Servicenow environment.","Enhance Workplace Efficiency with IoT Integration","Product Roadmap"
"A2E00289","Automated Asset Data Synchronization","Brightwave Technologies","The customer wants guidance on automating asset synchronization between ServiceNow and multiple third-party tracking platforms. Their objective is to eliminate manual reconciliation, avoid data mismatches, and ensure real-time updates across all systems for better decision-making.","Automated Asset Synchronization Strategy","Technical How-To"
"A2E00290","Employee Service Center","Unified Enterprises","The customer aims to streamline the employee onboarding process by automating manual tasks and integrating HR systems within ServiceNow. The approach is focused on reducing onboarding time, increasing compliance, and improving overall employee satisfaction.","Optimize Employee Onboarding Experience","Solution Review"
"A2E00291","App Engine Studio Deployment and Utilization","InnovaTech Solutions","The customer is seeking guidance on how to identify, activate, and leverage their underutilized App Engine entitlements. Their goal is to increase adoption across business units, ensure they are maximizing their investment in Servicenow, and understand best practices for rolling out new applications quickly and effectively.","Maximizing Value from Unused App Engine Entitlements","Product Overview"
"A2E00292","App Engine Sandbox Configuration","TechNova Solutions","The customer seeks best practices and technical steps to correctly configure and deploy a sandbox environment on ServiceNow App Engine. Their goal is to establish a safe area for prototyping, development, and testing without risk to production operations. They aim to understand sandbox limitations, user provisioning, data isolation, and recommended strategies for environment maintenance.","Sandbox Environment Setup Guidance","Technical How-To"
"A2E00293","Role Management and Permission Configuration","FutureTech Solutions","The customer aims to create a secure and collaborative environment within their custom ServiceNow apps by implementing robust user role management and permission structures. Their goal is to empower business users and IT teams to manage access dynamically, ensuring inclusivity and compliance while simplifying onboarding for new users.","Enabling Effective Role-Based Access Controls in Custom Applications","Technical How-To"
"A2E00294","Event Management","TechNova Solutions","The customer aims to enhance the scalability and efficiency of ITOM event processing to ensure reliable capture, correlation, and resolution of large volumes of infrastructure alerts. Their goal is to gain actionable insights and maintain system stability during periods of increased load through automated event handling.","Optimizing ITOM Event Management for High-Volume Processing","Solution Review"
"A2E00295","App Engine Automation","Horizon Technologies","The customer has reported challenges with missing automation features within App Engine, impacting their ability to streamline key business workflows. Their primary goal is to gain a clear understanding of available automation capabilities, future roadmap, and recommendations for optimizing automation in their current environment. They are looking for guidance on best practices and insight into planned enhancements to ensure their processes remain efficient and scalable.","Addressing Automation Gaps in App Engine","Product Roadmap"
"A2E00296","Notification Rules Management","Acme Solutions Ltd.","The ITSM manager seeks to understand advanced configuration of notification rules within ServiceNow to ensure timely and relevant communications across incident management workflows. The goal is to empower the team with best practices for customizing alerts, reducing noise, and improving stakeholder engagement. The customer aims to align notification policies with business priorities and automate escalation paths for critical issues.","Optimizing Notification Rule Configuration for Enhanced Incident Response","Technical How-To"
"A2E00297","Entitlement Management","CyberGuard Solutions","The customer aims to understand and resolve the issues arising from conflicting entitlement records within the Security product. Their goal is to ensure accurate access control, streamline entitlement management, and mitigate risks associated with duplicate or overlapping records. They seek guidance on best practices and technical solutions for maintaining clean entitlement data and avoiding future conflicts.","Resolving Conflicting Entitlement Records","Technical How-To"
"A2E00298","Offline Access and Synchronization","Acme Utilities Corp","The customer is seeking the ability for Field Service Management (FSM) users to access and update work orders and essential data even when internet connectivity is unavailable. Their goal is to improve technician efficiency in remote locations by advocating for robust offline capabilities, ensuring data sync when connectivity is restored, and minimizing operational disruptions.","Enable FSM Offline Functionality","Product Feedback"
"A2E00299","Dashboard Refresh Scheduling","Apex Solutions Group","The client seeks to assess and refine the refresh rates of their Strategic Portfolio Management dashboards to ensure timely availability of accurate data for decision-making. The objective is to balance system performance with real-time insights, enabling leadership to track project progress and portfolio health efficiently. The client aims to understand best practices and technical capabilities for scheduling dashboard data updates within the ServiceNow environment.","Optimizing Portfolio Dashboard Refresh Cycles","Technical How-To"
"A2E00300","Localization and Internationalization","Müller Group","The customer aims to enhance Risk Management processes by adding comprehensive German language support to the Risk module. Their goal is to ensure localization for German-speaking users, improve usability, and comply with regional requirements for language accessibility within ServiceNow.","Enable German Language Support in Risk Module","Product Feedback"
"A2E00301","Form Design and Accessibility","Acme Solutions","Our users have raised concerns that form fields in App Engine lack clear, accessible labels, leading to confusion and data entry errors. The goal is to enhance the clarity of field labeling for better user experience and compliance with accessibility standards.","Improve App Engine Field Usability","Product Feedback"
"A2E00302","Security Operations - Threat Intelligence","Atlas Financial Group","The customer is concerned about increasing cybersecurity risks and aims to strengthen their ability to monitor and respond to emerging threats and vulnerabilities across the organization. They seek to leverage Servicenow's capabilities to automate threat detection, streamline incident response, and gain real-time visibility into potential vulnerabilities.","Proactive Threat Detection Enhancement","Solution Review"
"A2E00303","Entitlement Management and Compliance","BrightWave Solutions","The customer wants to clarify how entitlements are managed when renewing several Servicenow products as part of a bundle. Their aim is to ensure that all critical services remain accessible and compliant post-renewal, and to learn how bundled renewal affects future product entitlements and licensing. They are looking for guidance on aligning entitlements with their evolving business needs.","Understanding Entitlements with Multi-Product Renewal Bundles","Entitlement"
"A2E00304","Event Management","Delta Solutions Group","The customer is interested in configuring real-time alerting mechanisms within their incident tracking dashboard, with the goal of ensuring key stakeholders are notified immediately of critical events. They want to leverage automation to minimize manual intervention and ensure rapid escalation procedures.","Interactive Alerting for Incident Response","Technical How-To"
"A2E00305","Platform Foundations","Orbital Solutions Ltd.","The customer aims to develop a comprehensive understanding of ServiceNow Platform Foundations to optimize internal workflows, ensure scalable architecture, and leverage best practices for implementation and maintenance. The goal is to equip their technical teams with the necessary skills to support ongoing platform expansion and integration.","Accelerate Platform Foundations Adoption","Technical How-To"
"A2E00306","Knowledge Management","Acme Corporation","Acme Corporation aims to improve cross-departmental collaboration and reduce repetitive inquiries by deploying a unified knowledge management platform. Their goal is to empower employees with quick access to curated information, streamline support processes, and enable continuous learning through up-to-date documentation and best practices.","Centralized Knowledge Hub Implementation","Product Overview"
"A2E00307","Employee Center Pro","FuturePath Technologies","The customer aims to create a unified digital experience for employees by collaborating across HR and Workplace Service Delivery modules. Their goal is to streamline processes, enhance engagement, and provide seamless access to services and resources. The approach focuses on leveraging automation, self-service, and data-driven insights to foster a proactive and adaptable organizational culture.","Elevating Employee Experience through Integrated HR and Workplace Solutions","Solution Review"
"A2E00308","Collaborative Ticket Closure Workflow","TechDynamics LLC","The customer is exploring methods for enabling multiple teams to close tickets in bulk within ServiceNow ITSM. They are interested in understanding the configuration options available to ensure the process is user-friendly and meets governance requirements. Their approach emphasizes collaboration between business and technical stakeholders to provide feedback, share knowledge, and align solution design with organizational standards.","Empowering Teams Through Bulk Closure Enablement","Solution Review"
"A2E00309","Real-Time Reporting","Sable Technologies Inc.","The organization requires a comprehensive overview of current risk assessment lags, with the intention to identify bottlenecks and improve transparency in risk calculations. They aim to implement best practices within Servicenow to streamline workflows and ensure stakeholders have timely access to critical risk data.","Enhancing Real-Time Risk Calculation Transparency","Technical How-To"
"A2E00310","Data Security and Access Controls","BrightPath Logistics","The customer is concerned about unauthorized access to Field Service Management (FSM) data within their Servicenow environment. Their goal is to understand best practices for securing FSM data and to ensure that only authorized personnel have access, while learning how to monitor and audit access scenarios.","Addressing Unauthorized FSM Data Access","Technical How-To"
"A2E00311","User Provisioning and License Management","Acme Financial Group","The customer requires additional ITSM licenses to support the onboarding of new team members. Their goal is to ensure seamless access to ServiceNow capabilities for all staff, avoiding service bottlenecks and maintaining operational efficiency. The customer is seeking guidance on optimal license allocation, user management best practices, and compliance with ServiceNow licensing policies.","Increase ITSM License Capacity for Onboarding","Technical How-To"
"A2E00312","Risk Scoring Models","BlueWave Enterprises","Our client wants to explore advanced risk scoring mechanisms for their change request intake in ServiceNow. They aim to learn how predictive risk models can be customized for their industry and how to leverage out-of-the-box features versus custom logic. Their approach includes evaluating feature gaps and assessing integration points with third-party risk analysis tools.","Advanced Risk Scoring for Change Requests","Product Overview"
"A2E00313","Predictive Workflow Analytics","FutureWave Enterprises","The company is focused on gaining deeper insights into latency patterns within App Engine workflows, aiming to elevate the customer experience by implementing predictive analytics and intelligent routing. They are looking to design forward-thinking architectures that anticipate and resolve workflow slowdowns before they impact end users.","Strategic Latency Reduction for Enhanced Customer Experience","Solution Review"
"A2E00314","Survey Analytics and Roadmap Alignment","Acme Financial Group","The customer aims to streamline how Net Promoter Score (NPS) survey results are reviewed and acted upon within the Servicenow platform. Their goal is to enhance visibility into customer sentiment trends, prioritize roadmap decisions based on feedback analytics, and enable faster alignment between customer needs and product development. They seek a standardized approach to aggregating and interpreting NPS responses to inform future product initiatives.","Improve Customer Feedback Integration","Product Feedback"
"A2E00315","Incident Escalation Policies","Acme Corp","The customer is seeking to reduce resolution times for incidents that remain unresolved by implementing automated escalation policies. Their goal is to understand how Servicenow can help configure, trigger, and track escalations to ensure critical issues receive timely attention from the appropriate teams.","Automated Escalation Management","Technical How-To"
"A2E00316","Contract Renewal Automation","BrightEdge Solutions Inc.","The customer requests insights into renewal processes and wants to establish effective reminders and tracking mechanisms for their App Engine contract. They are interested in understanding automation opportunities and integration points with procurement systems to streamline renewal workflows and maintain operational resilience.","Enhancing Renewal Visibility for App Engine","Solution Review"
"A2E00317","Service Catalog Automation","TechNova Systems","Our goal is to streamline and automate the process of provisioning approved services, reducing manual intervention and accelerating delivery times. We are seeking guidance on best practices and scalable automation strategies within ServiceNow to support rapid growth and evolving business needs.","Automated Service Provisioning Rollout","Technical How-To"
"A2E00318","Migration Timeline Planning","NovaTech Industries","The customer is aiming to migrate their customer service operations from legacy tools to ServiceNow Customer Service Management, with a focus on phased implementation. They wish to understand migration timelines, cutover planning, and how to prioritize feature rollouts to support both agents and customers effectively.","Customer Service Migration: Roadmap and Readiness","Product Roadmap"
"A2E00319","API Endpoint Monitoring","Acme Financial Group","The customer is seeking to enhance their monitoring strategy by gaining deeper visibility into the API endpoints exposed by Servicenow's IT Operations Management tools. Their goal is to understand the available endpoints, performance metrics, and best practices for integration, ultimately improving incident response and proactive issue detection.","Optimize API Endpoint Visibility for Monitoring","Technical How-To"
"A2E00320","License Management and Reporting","Acme Solutions Inc.","Customer seeks to understand how the recent product roadmap changes will impact license allocations, with a specific focus on optimizing usage and avoiding over-provisioning. The goal is to ensure all relevant teams have access without exceeding budget limits, leveraging Servicenow's advanced reporting and forecasting capabilities.","Refinement of License Allocation to Match New Platform Roadmap","Product Roadmap"
