"number","capability","company","description","initiative_title","primary_category"
"A2E00001","Reporting and Visualization Export","BrightVision Consulting","The customer needs an easy way to export dashboard visualizations as high-resolution images for presentations and reports. They are seeking guidance on available export features, best practices, and how to maintain image quality when sharing analytics outside the Servicenow platform.","Export Visualizations as High-Resolution Images","Technical How-To"
"A2E00002","User Authentication and Security Policies","Acme Financial Solutions","The customer is concerned about the risk of unauthorized access due to repeated failed login attempts. Their goal is to implement an effective account lockout mechanism that balances security and user experience, ensuring legitimate users can regain access easily while locking accounts only in cases of suspicious activity.","Enhance Account Security via Intelligent Lockout","Technical How-To"
"A2E00003","Data Storage Management","CloudBridge Inc.","The team has recently experienced rapid growth and has approached us with concerns about running out of storage capacity within their current configuration. Their primary goal is to ensure seamless scalability and avoid any disruptions to ongoing projects. They are seeking guidance on the best practices for expanding storage in the Servicenow environment and want to understand available options, costs, and technical implications before proceeding.","Request for Increased Storage Capacity","Technical How-To"
"A2E00004","Role-Based Access Control (RBAC)","Northbridge Solutions","The customer seeks to implement view-only permissions for selected users within their ServiceNow environment to restrict editing capabilities while maintaining transparency and access to critical information. Their goal is to ensure compliance with internal audit requirements and minimize risks associated with unauthorized changes to workflows and records.","Enable View-Only Access for Targeted User Groups","Technical How-To"
"A2E00005","Analytics and Reporting","Acme Enterprises","The customer seeks guidance on understanding the significance and impact of detected anomalies in trend reports, aiming to interpret these results to make informed business decisions and improve operational efficiency.","Interpreting Trend Report Anomalies","Technical How-To"
"A2E00006","Event Management with Automated Alerting","NovaTech Solutions","The customer is concerned about sudden increases in ticket volume and seeks strategies to proactively detect and respond to these spikes. Their goal is to leverage analytics and automation to reduce response time, minimize potential service disruptions, and maintain high customer satisfaction.","Proactive Alerting for Ticket Volume Spikes","Technical How-To"
"A2E00007","Anomaly Detection and Alerting","Acme Solutions","The customer wants to set up configurable thresholds for anomaly notifications to proactively identify performance or security issues before they impact end users. They are seeking best practices on threshold management and alerting to optimize monitoring.","Configurable Anomaly Notification Thresholds","Technical How-To"
"A2E00008","Incident Management","Acme Corp","Following a recent update to the ServiceNow platform, the user has encountered a bug that affects incident ticket routing. The customer aims to understand the root cause, ensure future update stability, and enhance their team's troubleshooting capabilities.","Incident Routing Bug Investigation Post-Update","Technical How-To"
"A2E00009","License Provisioning Automation","Apex Dynamics Inc.","The company is onboarding a significant number of new hires and wants to streamline the process of assigning the correct software licenses. The team is looking to automate license provisioning based on predefined roles, reduce manual errors, and improve compliance tracking throughout the onboarding workflow.","Automated Software License Assignment for New Hires","Solution Review"
"A2E00010","User Access Management","Acme Corporation","The new employee requires access to the platform dashboard to effectively monitor key operational metrics and participate in team workflows. The goal is to ensure user onboarding is seamless, permissions are correctly configured, and the employee can leverage platform capabilities for day-to-day activities.","Enable Dashboard Access for New Employee","Technical How-To"
"A2E00011","User Administration","Brightline Solutions","The customer is experiencing difficulty resetting user passwords within their ServiceNow environment, leading to delays and frustration for end users. They wish to understand best practices for manual password resets and would like to implement a more efficient process with minimized risk and improved auditability.","Streamline Manual Password Reset Process","Technical How-To"
"A2E00012","User Access Audit Reporting","TechNova Solutions","The customer is concerned about the lack of transparency in analytics dashboard access. They want to gain deeper insights into who is accessing sensitive dashboards, when, and from where, to ensure compliance with internal audit policies. Their goal is to implement robust monitoring and reporting on dashboard usage within the Servicenow platform.","Audit Analytics Dashboard Access for Compliance","Solution Review"
"A2E00013","Password Reset Automation","Acme Financial Services","The customer aims to streamline and secure the password reset process for employees, ensuring minimal downtime and enhanced user experience. The initiative seeks to leverage automated workflows and self-service capabilities for password management, reducing IT workload and improving overall security posture.","Empowering Secure Self-Service Password Reset","Technical How-To"
"A2E00014","Role-Based Access Control for Analytics","Brightwave Solutions","The customer is seeking elevated permissions within the analytics module to enable advanced reporting and deeper data insights for their organization. Their goal is to understand how to securely grant these permissions while maintaining compliance and auditability.","Enable Advanced Analytics Access","Technical How-To"
"A2E00015","Automation Engine","Vertex Solutions Inc.","Our team is interested in participating in the beta program to explore advanced automation capabilities and understand how upcoming features can streamline our IT operations and service delivery. We aim to collaborate closely with product teams and provide meaningful feedback during the program.","Beta Program Participation for IT Automation","Product Feedback"
"A2E00016","Reporting and Analytics Integration","BrightEdge Solutions","The customer seeks to connect their Servicenow platform to an external analytics tool in order to enhance reporting capabilities, optimize business insights, and enable advanced data visualization. They are particularly interested in understanding integration options, data flows, and best practices for maintaining data security during external connections.","Integrate Servicenow with External Analytics","Technical How-To"
"A2E00017","Performance Analytics","BrightPath Solutions","The customer is looking for guidance on designing a personalized KPI dashboard that provides actionable insights across key business processes. They are interested in understanding best practices for dashboard configuration, data visualization techniques, and integration with existing reporting systems. The customer wants to leverage Servicenow's capabilities to tailor dashboards to different user roles and improve performance monitoring.","Personalized KPI Dashboard Guidance","Technical How-To"
"A2E00018","Self-Service Password Reset","BlueTech Solutions","Customer aims to streamline the process for users to request password resets securely, ensuring minimal downtime and enhanced self-service capabilities.","Simplify User Password Reset Requests","Technical How-To"
"A2E00019","IntegrationHub","TechNova Solutions","The customer is experiencing recurring failures during scheduled data synchronizations between two integral platforms. They are seeking to understand the underlying causes and wish to explore ways to increase reliability and monitoring for integration jobs. Additionally, the customer wants guidance on best practices for troubleshooting and proactive notifications of sync issues.","Improve Data Sync Reliability Between Platforms","Technical How-To"
"A2E00020","User Account Management","Acme Financial Services","The customer is seeking to enhance account recovery processes by updating and securing their security questions within their ServiceNow platform. Their goal is to ensure a more robust and user-friendly recovery mechanism, reducing the risk of unauthorized access while improving the overall user experience for end-users who need to regain access to their accounts.","Strengthen Account Recovery with Updated Security Questions","Technical How-To"
"A2E00021","Performance Analytics Dashboards","Insight Dynamics Ltd.","The customer aims to enhance their reporting capabilities within Servicenow, with a particular focus on integrating visualizations into their generated reports to facilitate better decision-making and trend analysis. They seek guidance on best practices for implementing dashboards and visual analytics to meet evolving business needs.","Integrate Visual Analytics in Reporting","Technical How-To"
"A2E00022","Knowledge Management","TechNova Solutions","The customer aims to streamline the process of publishing troubleshooting guides for recurring technical issues to improve resolution times and empower support teams with self-service resources.","Accelerate Troubleshooting Guide Publishing","Technical How-To"
"A2E00023","Performance Analytics Widget Customization","Acme Solutions Ltd.","The customer aims to gain actionable insights from real-time performance metrics on their dashboard, focusing on customization options for various widgets to fit distinct team requirements. They are concerned about optimizing data refresh rates and ensuring seamless integration with existing reporting tools.","Custom Dashboard Widgets for Real-Time Analytics","Product Overview"
"A2E00024","IntegrationHub","Acme Solutions Ltd.","The customer seeks to establish a seamless process for automating ticket creation from an external system into the ServiceNow platform. Their goal is to reduce manual intervention, improve operational efficiency, and ensure timely resolution of incidents by leveraging integration capabilities and automated workflows.","Automated Ticket Ingestion from External Systems","Technical How-To"
"A2E00025","Service Level Management","Acme Logistics Inc.","Our team is seeking guidance on establishing new service-level agreements with third-party vendors to ensure consistent performance and accountability. We want to clearly define response times, escalation procedures, and measurable outcomes within the Now Platform to better support our business needs and vendor relationships.","Optimizing SLA Management for Vendor Partnerships","Solution Review"
"A2E00026","Case Management for HR Service Delivery","BrightTech Solutions","The customer aims to simplify and automate the process for employees to request cancellation of their previously submitted leave requests. Their goal is to enhance user experience, reduce manual HR intervention, and ensure all changes to leave records are tracked and audited efficiently using Servicenow. They are seeking guidance on best practices, workflow configurations, and integration capabilities to support their HR team's needs.","Leave Cancellation Request Streamlining","Technical How-To"
"A2E00027","Database Management and Upgrade","BluePeak Solutions","The customer aims to upgrade their current database software to the latest supported version to enhance performance, security, and compatibility with future ServiceNow releases. They are seeking best practices, upgrade steps, and guidance on minimizing downtime during the transition.","Database Software Upgrade Planning","Technical How-To"
"A2E00028","Root Cause Analysis Workspace","Apex Communications","The customer is concerned about frequent network outages impacting operational continuity and is seeking a comprehensive understanding of Servicenow capabilities to identify, analyze, and prevent recurring issues. Their goal is to leverage advanced analytics and root cause investigation tools to minimize downtime, improve incident response efficiency, and develop a sustainable strategy for network reliability.","Proactive Network Stability Enhancement","Solution Review"
"A2E00029","Automated Discovery and Asset Management","EdgeGuard Solutions","The customer seeks to strengthen their security posture by automatically identifying and onboarding new devices as they are detected on the network. This initiative aims to leverage ServiceNow's automated discovery capabilities to ensure all assets are accounted for and rapidly incorporated into asset management and security workflows. The approach focuses on minimizing manual intervention and providing real-time visibility into network changes to support compliance and risk management objectives.","Proactive Network Asset Discovery Enhancement","Technical and business Strategy"
"A2E00030","Report Access Management","FinTrust Solutions","The customer aims to configure granular permissions for their audit teams, ensuring team members only access specific financial reports within ServiceNow. They need guidance on leveraging the platform's access controls to comply with internal security policies while maintaining operational efficiency.","Streamlining Report Access for Audit Teams","Technical How-To"
"A2E00031","Knowledge Management","GlobalConnect Corp","The customer aims to enhance user engagement and accessibility by translating key ServiceNow knowledge articles into multiple languages. Their goal is to foster an inclusive environment where global employees and customers can access essential information in their preferred language, supporting a seamless and collaborative experience across regions.","Multilingual Knowledge Article Expansion","Technical How-To"
"A2E00032","Asset Deduplication and Data Integrity","Summit Technologies","The customer has identified multiple duplicate entries for the same device within their asset inventory, leading to confusion and potential compliance risks. Their goal is to understand best practices for asset deduplication, improve data integrity, and prevent future duplications by leveraging ServiceNow's asset management functions and recommendations.","Elimination of Duplicate Asset Records","Technical How-To"
"A2E00033","Asset Management Audit Trail","BrightPath Solutions","Our team is seeking a reliable way to document and audit all changes made to critical IT assets. We want a transparent process that allows us to quickly identify who made what change, when, and why—reducing risk and supporting compliance requirements. The goal is to leverage ServiceNow's capabilities to streamline asset audit trails and empower staff with clear visibility.","Improving Asset Change Traceability","Technical How-To"
"A2E00034","Root Cause Analysis","Summit Logistics Group","The customer aims to improve their ability to identify and address root causes of recurring incidents within their IT service management processes. Their goal is to gain deeper visibility into incident patterns using advanced analytics, streamline investigation workflows, and proactively reduce service disruptions. They seek guidance on leveraging Servicenow capabilities for comprehensive root cause analysis, including best practices for data classification and reporting.","Enhancing Incident Resolution Insights","Technical How-To"
"A2E00035","Security Operations","Apex Financial Group","Customer aims to ensure all ServiceNow modules are configured to meet external audit requirements, focusing on access controls, data integrity, and incident management. The approach includes a review of current configurations, identification of gaps, and implementation of recommended best practices.","Strengthen Security Compliance for Audit","Solution Review"
"A2E00036","Audit Management","SableTech Solutions","The customer seeks to address gaps identified during a recent audit by implementing a structured remediation plan. Their goal is to better understand best practices for compliance, optimize current processes in the Risk Management module, and ensure continuous monitoring to prevent future audit findings. The approach includes targeted training for staff and configuration review sessions.","Post-Audit Remediation Plan Alignment","Solution Review"
"A2E00037","Asset Management and Tracking","Acme Facilities Solutions","The customer has reported missing equipment after a recent service visit. Their goal is to understand how ServiceNow's asset tracking capabilities can help prevent such incidents, improve accountability, and streamline the reporting process. They aim to learn about real-time asset visibility and automated incident reporting to strengthen equipment control.","Addressing Missing Equipment Reports Post-Service","Technical How-To"
"A2E00038","User Interface Modernization","IntegriTech Solutions","The customer is seeking to understand the recent changes introduced in the latest ServiceNow platform update, with a particular focus on usability improvements and any new features. Their goal is to ensure seamless adoption for their teams and to provide meaningful feedback on areas that may require further refinement. They are interested in learning how the update impacts their existing workflows and how best to leverage new capabilities.","Enhancing User Experience Post-Upgrade","Product Feedback"
"A2E00039","IntegrationHub","BluePeak Solutions","The customer seeks to enhance their platform's integration capabilities to better support existing and potential partners. They are interested in understanding how to leverage ServiceNow's integration features to enable seamless data exchange and workflow automation with third-party solutions. Their goal is to ensure that future partnerships can be onboarded quickly, driving business growth while maintaining a high level of service reliability.","Integration Feature Expansion for Strategic Partnerships","Product Overview"
"A2E00040","Workflow Automation","InnovateHR Solutions","The customer seeks to streamline and automate the process for managers to approve bonus recommendations, aiming for improved transparency and faster decision making. Their goal is to empower managers with clear guidelines and better visibility into the bonus approval workflow, fostering a collaborative and equitable environment.","Manager Bonus Recommendation Approval Enhancement","Solution Review"
"A2E00041","Localized Knowledge Management","Globex Corporation","The customer seeks onboarding documentation delivered in their preferred language to ensure comprehensive understanding and effective adoption of the Servicenow platform. Their objective is to facilitate a seamless onboarding experience for all team members regardless of native language, supporting global operations and inclusive training practices.","Multilingual Onboarding Documentation Request","Product Overview"
"A2E00042","AI Case Routing and Assignment","BrightPath Solutions","The executive team is pushing to rapidly implement advanced AI-based case routing to streamline our support operations. Their goal is to significantly reduce case resolution time and improve end-user satisfaction by leveraging Servicenow's latest AI and automation capabilities. The team seeks a deep understanding of product limitations, potential integration strategies, and best practices for deploying this high-impact feature.","Accelerate AI-driven Case Assignment","Product Roadmap"
"A2E00043","Proactive Monitoring & Incident Management","Lambda Solutions Inc.","The customer aims to ensure ongoing platform stability and maximize the value of their renewed annual maintenance contract by deepening their understanding of proactive monitoring tools, incident management best practices, and upgrade planning within the ServiceNow ecosystem.","Annual Maintenance Contract Renewal Enablement","Product Overview"
"A2E00044","Release Management","TransNova Solutions","After reviewing extensive feedback from our beta testers, the customer aims to adjust the release schedule of key Servicenow modules to prioritize functionality most needed by end users. The focus is on ensuring the revised roadmap aligns with user expectations and maximizes adoption, while minimizing disruption to existing workflows.","Reorder Release Roadmap Based on Beta Feedback","Product Roadmap"
"A2E00045","Workflow Automation","BrightWave Logistics","The customer is seeking to optimize the process for submitting and approving overtime hours to ensure accurate tracking, transparency, and compliance across departments. Their goal is to leverage automation and reporting capabilities to reduce administrative workloads and minimize approval delays, while maintaining audit integrity.","Streamlined Overtime Approval Workflow","Solution Review"
"A2E00046","Service Level Management","Greenfield Manufacturing","The customer wants to guarantee that all onsite and remote service visits are scheduled and performed in strict alignment with the timelines outlined in their contract SLAs. They require real-time visibility into visit scheduling, proactive notifications for upcoming or missed appointments, and comprehensive tracking to ensure SLA adherence.","Ensure Timely Service Visits per Contract SLA","Technical How-To"
"A2E00047","Security Incident Response","CyberGuard Solutions","The customer is seeking to improve their incident response processes in light of the increasing frequency and sophistication of recent cyberattacks. Their goal is to better detect, analyze, and remediate security incidents across their enterprise, leveraging automation and integrated workflows in Servicenow. They are particularly interested in actionable dashboards, automated playbooks, and advanced threat intelligence integration.","Enhancing Incident Response for Evolving Cyber Threats","Technical and business Strategy"
"A2E00048","Business Continuity Management","Axis Financial Group","The customer seeks expert advice on establishing and enhancing business continuity protocols using ServiceNow. Their goal is to understand best practices, risk mitigation strategies, and how ServiceNow capabilities can support resilient operations in the face of disruptions. They are interested in a comprehensive review of available product features and guidance on aligning continuity plans with organizational objectives.","Business Continuity Planning Guidance","Solution Review"
"A2E00049","Release Management Automation","BrightWave Financial","The customer aims to minimize delays in rolling out new features during the holiday season by leveraging automated release management and enhanced collaboration tools, ensuring timely updates without impacting end-user experience.","Accelerate Feature Deployment Amid Holiday Constraints","Product Roadmap"
"A2E00050","Asset Management","Acme Logistics Ltd.","The customer has reported missing equipment following a recent service visit, leading to concerns about asset tracking and loss prevention. Their primary goal is to strengthen visibility and accountability for physical assets during and after service management activities. They are seeking to understand how Servicenow's asset management capabilities can help log, monitor, and audit equipment movements tied to service events, ensuring all assets are accounted for post-service.","Equipment Tracking and Accountability Enhancement","Solution Review"
"A2E00051","ITOM Optimization and Renewal Readiness","Acme Financial Group","The customer aims to optimize their ServiceNow IT Operations Management (ITOM) renewal process by gaining a deeper understanding of upcoming product enhancements and best practices for value realization. They seek to ensure seamless continuity of services while exploring advanced features that could contribute to operational efficiency.","Proactive ITOM Renewal Planning","Product Overview"
"A2E00052","Performance Optimization","BrightPath Solutions","The company needs to reduce the time taken to generate HR analytics reports, as current delays are affecting business operations. They seek best practices, technical optimizations, and guidance on leveraging Servicenow capabilities for faster report delivery.","Enhance Report Generation Performance","Technical How-To"
"A2E00053","Workplace Service Delivery","Global Solutions Enterprises","The customer seeks to understand how new features in the Workplace module can support their evolving remote work strategies. Their goal is to optimize employee experience, streamline space management, and ensure seamless collaboration regardless of physical location. They are interested in learning about the latest capabilities, best practices, and future roadmap of the module to align with their organization's digital transformation and hybrid work environment.","Enhancing Workplace Module for Remote Collaboration","Product Roadmap"
"A2E00054","Security Threat Intelligence","CyberGuard Solutions","The customer aims to enhance their security posture by integrating threat intelligence capabilities into their ServiceNow environment. Their goal is to proactively identify, assess, and mitigate emerging security threats using advanced threat intelligence features. The customer seeks guidance on setup, best practices, and integration with existing security operations workflows.","Upgrade to Security Threat Intelligence","Technical How-To"
